Source_URL,Username,Review,Cleaned_Review,Rating,Date,Sentiment
https://www.tokopedia.com/richerlaptop/laptop-t470-s-touchscreen-no-touchscreen-intel-core-series-ram-8-20-ssd-128-256-512gb-1730007805500426368/review,P***m,"Kesehatan battrei hanya 60% di baterai 1, dan baterai 2 seperti difoto...",kesehatan battrei hanya  di baterai  dan baterai  seperti difoto,3,1 minggu lalu,netral
https://www.tokopedia.com/globallaptopthinkpad/laptop-lenovo-thinkpad-t480-t480s-intel-i5-i7-gen-8-ram-4-8-gb-ssd-t480-i7gn8-2vga-8gb-ssd-256gb-ad6f6/review,A***r,komunikasi harus diutamakan karena orang pesan artinya butuh utk pakai barangnya,komunikasi harus diutamakan karena orang pesan artinya butuh utk pakai barangnya,1,Lebih dari 1 tahun lalu,negatif
https://www.tokopedia.com/globallaptopthinkpad/laptop-lenovo-thinkpad-t480-t480s-intel-i5-i7-gen-8-ram-4-8-gb-ssd-t480-i7gn8-2vga-8gb-ssd-256gb-ad6f6/review,Heri,"resolusi layar tidak sesuai dengan yg di deskripsi, kirain akan diganti lcdnya sesuai dengan yg di deskripsi, ternyata tidak",resolusi layar tidak sesuai dengan yg di deskripsi kirain akan diganti lcdnya sesuai dengan yg di deskripsi ternyata tidak,3,Lebih dari 1 tahun lalu,netral
https://www.tokopedia.com/dna-com-17/lenovo-thinkpad-x240-x250-x260-x270-x280-x290-i3-i5-i7-second-original-berkualitas-bergaransi-1731365752961468092/review,H***a,"maaf saya memberi feedback negatif!!!.
karena sesuai fakta dan data.
pelapak slow respon dan tidak ada tanggapan serius perihal komplain.
barang ada cacat sedikit di lcd...","maaf saya memberi feedback negatif
karena sesuai fakta dan data
pelapak slow respon dan tidak ada tanggapan serius perihal komplain
barang ada cacat sedikit di lcd",1,Lebih dari 1 tahun lalu,negatif
https://www.tokopedia.com/dna-com-17/lenovo-thinkpad-x240-x250-x260-x270-x280-x290-i3-i5-i7-second-original-berkualitas-bergaransi-1731365752961468092/review,Heryan,"Unit hanya bisa dipakai hanya 2 bulan saja, setelah itu low critical battery terus, setelah dicek ternyata internal battery tidak ada, berarti dicopoti sebelum dikirim.",unit hanya bisa dipakai hanya  bulan saja setelah itu low critical battery terus setelah dicek ternyata internal battery tidak ada berarti dicopoti sebelum dikirim,1,Lebih dari 1 tahun lalu,negatif
https://www.tokopedia.com/dna-com-17/lenovo-thinkpad-x240-x250-x260-x270-x280-x290-i3-i5-i7-second-original-berkualitas-bergaransi-1731365752961468092/review,Ahmad,keyboard cina....characternya berbeda2 dgn slyg standard waktu di pencet...,keyboard cinacharacternya berbeda dgn slyg standard waktu di pencet,2,Lebih dari 1 tahun lalu,negatif
https://www.tokopedia.com/dna-com-17/lenovo-thinkpad-x240-x250-x260-x270-x280-x290-i3-i5-i7-second-original-berkualitas-bergaransi-1731365752961468092/review,Yames,Lebih dari 1 tahun lalu,lebih dari  tahun lalu,2,Lebih dari 1 tahun lalu,negatif
https://www.tokopedia.com/dna-com-17/lenovo-thinkpad-x240-x250-x260-x270-x280-x290-i3-i5-i7-second-original-berkualitas-bergaransi-1731365752961468092/review,A***d,Lebih dari 1 tahun lalu,lebih dari  tahun lalu,2,Lebih dari 1 tahun lalu,negatif
https://www.tokopedia.com/dna-com-17/lenovo-thinkpad-x240-x250-x260-x270-x280-x290-i3-i5-i7-second-original-berkualitas-bergaransi-1731365752961468092/review,Muhammad,"kalau pelayanan pass mau beli ok sih
tp gtu lah
padahall sdh saya samapaikan untk di jual lagi
agar di periksa kembali.
tp gtu lah
pass sudah sampai
wifi gk bisa langsung...","kalau pelayanan pass mau beli ok sih
tp gtu lah
padahall sdh saya samapaikan untk di jual lagi
agar di periksa kembali
tp gtu lah
pass sudah sampai
wifi gk bisa langsung",3,Lebih dari 1 tahun lalu,netral
https://www.tokopedia.com/dna-com-17/lenovo-thinkpad-x240-x250-x260-x270-x280-x290-i3-i5-i7-second-original-berkualitas-bergaransi-1731365752961468092/review,Rossita,Lebih dari 1 tahun lalu,lebih dari  tahun lalu,3,Lebih dari 1 tahun lalu,netral
https://www.tokopedia.com/us-electronic/mulus-lenovo-t14-g1-core-i5-gen-10-touchscreen-ram-32gb-1tb-ssd-1732677758905975937/review,L***a,1 buah hardisk sentinel 91% pesanan 3 bh yg 2 bh ok,buah hardisk sentinel  pesanan  bh yg  bh ok,1,Lebih dari 1 tahun lalu,negatif
https://www.tokopedia.com/us-electronic/mulus-lenovo-t14-g1-core-i5-gen-10-touchscreen-ram-32gb-1tb-ssd-1732677758905975937/review,3 orang terbantu,Hardisk pertama sudah di retur tapi hardisk retur nya tidak sampai lagi ke saya.. info nya sudah jne ini sudah 4 harii padahal Masih 1 kota,hardisk pertama sudah di retur tapi hardisk retur nya tidak sampai lagi ke saya info nya sudah jne ini sudah  harii padahal masih  kota,1,Lebih dari 1 tahun lalu,negatif
https://www.tokopedia.com/alvinluo-shop/laptop-lenovo-thinkpad-x1-yoga-core-i7-gen-8-ram-16gb-ssd-256gb-14-inch-fhd-1733505128291141417/review,Joko,Varian: X1 Yoga i7-7 - 16GB/1TB,varian x yoga i  gbtb,1,10 bulan lalu,negatif
https://www.tokopedia.com/thinkpadofficial/lenovo-ideapad-slim-3i-14irh10-core-i5-13420h-16gb-512ssd-windows-11-office-14-inch-ips-laptop-3nid-1731426050212726154/review,Jubaidin,mosh nya   gak ada. excel wordnya blom  diploid  hanya  itu aje,mosh nya   gak ada excel wordnya blom  diploid  hanya  itu aje,3,Lebih dari 1 tahun lalu,netral
https://www.tokopedia.com/singaasiaplaza/lenovo-thinkpad-t430-core-i5-gen3-ram-8gb-ssd-512gb/review,Moch,"Mantab, sesuai pesanan, pesanan datang dengan kondisi yang sangat mulus semua aman dan lancar dapat bonus tas lagi, penjual sangat responsip, next order lagi, buat temen&...",mantab sesuai pesanan pesanan datang dengan kondisi yang sangat mulus semua aman dan lancar dapat bonus tas lagi penjual sangat responsip next order lagi buat temen,1,Lebih dari 1 tahun lalu,negatif
https://www.tokopedia.com/singaasiaplaza/lenovo-thinkpad-t430-core-i5-gen3-ram-8gb-ssd-512gb/review,Acep,"kamera tak berfungsi, dan sekarang layar laptop ga bisa diangkat sama sekali, alias ketutup 100%. Kemungkinan engsel nya rusak dan harus diservis.",kamera tak berfungsi dan sekarang layar laptop ga bisa diangkat sama sekali alias ketutup  kemungkinan engsel nya rusak dan harus diservis,1,8 bulan lalu,negatif
https://www.tokopedia.com/singaasiaplaza/lenovo-thinkpad-t430-core-i5-gen3-ram-8gb-ssd-512gb/review,I***n,Lebih dari 1 tahun lalu,lebih dari  tahun lalu,1,Lebih dari 1 tahun lalu,negatif
https://www.tokopedia.com/singaasiaplaza/lenovo-thinkpad-t430-core-i5-gen3-ram-8gb-ssd-512gb/review,K***o,"Untuk kualitas laptop memang mulus like new, dengan layar yg HD karena kata seller stok yg HD+ semuanya ada whitespotnya. tp sy kecewa terkait harddisk, harddisk tidak ad...",untuk kualitas laptop memang mulus like new dengan layar yg hd karena kata seller stok yg hd semuanya ada whitespotnya tp sy kecewa terkait harddisk harddisk tidak ad,2,Lebih dari 1 tahun lalu,negatif
https://www.tokopedia.com/singaasiaplaza/lenovo-thinkpad-t430-core-i5-gen3-ram-8gb-ssd-512gb/review,Bapa,Memorinya hanya 300gb,memorinya hanya gb,3,Lebih dari 1 tahun lalu,netral
https://www.tokopedia.com/us-electronic/borongan-lenovo-thinkpad-t470-i5-7th-32gb-512-gb-ssd-free-tas-1733831459578545281/review,R***f,"sebelum order sy nanya stok yg 10600 dan 12800. mau beli masing2 3 pcs.

saat checkout di note juga udah ditulis.
yang dikirim malah 12800 2 pcs, sisanya 8500 4 pcs.

sy...","sebelum order sy nanya stok yg  dan  mau beli masing  pcs

saat checkout di note juga udah ditulis
yang dikirim malah   pcs sisanya   pcs

sy",1,Lebih dari 1 tahun lalu,negatif
https://www.tokopedia.com/us-electronic/borongan-lenovo-thinkpad-t470-i5-7th-32gb-512-gb-ssd-free-tas-1733831459578545281/review,a***o,"tidak bisa dipakai alias rusak. udah dicoba semua laptop, hasilnya sama.",tidak bisa dipakai alias rusak udah dicoba semua laptop hasilnya sama,1,Lebih dari 1 tahun lalu,negatif
https://www.tokopedia.com/us-electronic/borongan-lenovo-thinkpad-t470-i5-7th-32gb-512-gb-ssd-free-tas-1733831459578545281/review,D***M,"maksud hati, mengambil dari toko ini sedikit lebih mahal dari toko samping karena dijanjikan penjual diberi chip hinix, sesuai di chat dan pmesanan. ternyata yg datang te...",maksud hati mengambil dari toko ini sedikit lebih mahal dari toko samping karena dijanjikan penjual diberi chip hinix sesuai di chat dan pmesanan ternyata yg datang te,3,Lebih dari 1 tahun lalu,netral
https://www.tokopedia.com/spacetech/lenovo-ideapad-slim-1-n4500-8gb-256gb-ssd-14-hd-win11-ohs-1731288271460075129/review,Jauhary,"maaf bintang dua, krn barangnya yg dikirim brg baru tp bekas diservis oleh service center, krn didalam dus ada nota service yg nama pelanggannya adalah nama penjual sendi...",maaf bintang dua krn barangnya yg dikirim brg baru tp bekas diservis oleh service center krn didalam dus ada nota service yg nama pelanggannya adalah nama penjual sendi,2,Lebih dari 1 tahun lalu,negatif
https://www.tokopedia.com/artlaptop/laptop-lenovo-thinkpad-core-i7-i5-ram-8gb-ssd-256gb-bergaransi-t430-core-i5-3-ram-4-hdd-500-36853/review,A***i,"Saya pesan lenovo thinkpad
Yang di kirim malah dell latitude
Sangat mengecewakan...","saya pesan lenovo thinkpad
yang di kirim malah dell latitude
sangat mengecewakan",1,4 bulan lalu,negatif
https://www.tokopedia.com/redstarelectronic/laptop-lenovo-thinkpad-t480s-core-i7-8th-24gb-512gb-murah-berkualitas-t460-i5-gen-6-8gb-256gb-ssd/review,DIRWAN,windowsnya eror nga bisa di pake mending beli baru deh 😔😔,windowsnya eror nga bisa di pake mending beli baru deh,2,11 bulan lalu,negatif
https://www.tokopedia.com/redstarelectronic/laptop-lenovo-thinkpad-t480s-core-i7-8th-24gb-512gb-murah-berkualitas-t460-i5-gen-6-8gb-256gb-ssd/review,Zulkifli,"laptop fundsi nirmal hanya saja ada 2 masalah:
1. di deskripsi i7 8650 dikirim i7 8550.
2. kabel power charger rusak, setelah diganti baru bisa charging.","laptop fundsi nirmal hanya saja ada  masalah
 di deskripsi i  dikirim i 
 kabel power charger rusak setelah diganti baru bisa charging",3,Lebih dari 1 tahun lalu,netral
https://www.tokopedia.com/laptopchoice/laptop-lenovo-thinkpad-x260-core-i3-i5-i7-layar-12-5-inch-mulus-x260-i5gen6-ram8gb-ssd128gb-643e/review,Wisnu,"laptop hidup, fungsi lainnya belum dicoba mudah mudahan aman",laptop hidup fungsi lainnya belum dicoba mudah mudahan aman,2,Lebih dari 1 tahun lalu,negatif
https://www.tokopedia.com/juraganidn/lenovo-thinkpad-t490-t480-i7-8650u-ram-16gb-ssd-1tb-mulussss-bergaransi-1729993303370663485/review,Muhammad,"Admin dan Teknisi tidak profesional dikarenakan:

1. Pengiriman Lama (padahal saya memilih pengiriman same day dengan maks 8 jam pengiriman sejak pembayaran)

2. Admin ti...","admin dan teknisi tidak profesional dikarenakan

 pengiriman lama padahal saya memilih pengiriman same day dengan maks  jam pengiriman sejak pembayaran

 admin ti",1,Lebih dari 1 tahun lalu,negatif
https://www.tokopedia.com/juraganidn/lenovo-thinkpad-t490-t480-i7-8650u-ram-16gb-ssd-1tb-mulussss-bergaransi-1729993303370663485/review,T***a,"produk bermasalah , chat Tidak dibalas",produk bermasalah  chat tidak dibalas,2,11 bulan lalu,negatif
https://www.tokopedia.com/starjayaelectronic/lenovo-thinkpad-t480s-core-i7-8650u-24gb-ram-512gb-nvme-ssd-ts-full-hd-1733593194371975083/review,Boyke,"Pertama dikirim laptop yg windowsnya tdk jalan
Yg ke dua dikirim Laptop Windows Health dan battery health nya rendah
Tidak ada opsi Batal, yg ada tukar barang 
Pagi ongki...","pertama dikirim laptop yg windowsnya tdk jalan
yg ke dua dikirim laptop windows health dan battery health nya rendah
tidak ada opsi batal yg ada tukar barang 
pagi ongki",1,Lebih dari 1 tahun lalu,negatif
https://www.tokopedia.com/starjayaelectronic/lenovo-thinkpad-t480s-core-i7-8650u-24gb-ram-512gb-nvme-ssd-ts-full-hd-1733593194371975083/review,Felius,Laptop bermasalah. Seharusnya sebelum di kirim laptop di QC terlebih dulu,laptop bermasalah seharusnya sebelum di kirim laptop di qc terlebih dulu,2,Lebih dari 1 tahun lalu,negatif
https://www.tokopedia.com/electrocom/lenovo-thinkpad-x280-touchscreen-i5-gen8-ram-16gb-512gb-ultrabook-1733657196012995842/review,a***i,"unit tidak sesuai dengan apa yg d pesan saya pesan x280 yg datang malah x 260, dan unit juga bermasalah dalam kondisi hidup ketika d angkat dan hendak ingin meletakan uni...",unit tidak sesuai dengan apa yg d pesan saya pesan x yg datang malah x  dan unit juga bermasalah dalam kondisi hidup ketika d angkat dan hendak ingin meletakan uni,1,Lebih dari 1 tahun lalu,negatif
https://www.tokopedia.com/electrocom/lenovo-thinkpad-x280-touchscreen-i5-gen8-ram-16gb-512gb-ultrabook-1733657196012995842/review,ARSARIUS,"Order yg Touchscreen, tpi yg dikirim yg bkn TS,
Alasan salah kirim, disuruh Retur
Ribet, katanya mau transfer kompensasi, tapi tk kunjung dikirim sdh hampir semingguan
Ba...","order yg touchscreen tpi yg dikirim yg bkn ts
alasan salah kirim disuruh retur
ribet katanya mau transfer kompensasi tapi tk kunjung dikirim sdh hampir semingguan
ba",1,Lebih dari 1 tahun lalu,negatif
https://www.tokopedia.com/electrocom/lenovo-thinkpad-x280-touchscreen-i5-gen8-ram-16gb-512gb-ultrabook-1733657196012995842/review,8 orang terbantu,"Microphonenya cacat udah pake headset, udah liat banyak bgt tutorial yt masih aja g bnr micnya. kek ngambil kucing dalam karung, bisa dapat bagus bisa juga dapat cacat. k...",microphonenya cacat udah pake headset udah liat banyak bgt tutorial yt masih aja g bnr micnya kek ngambil kucing dalam karung bisa dapat bagus bisa juga dapat cacat k,1,Lebih dari 1 tahun lalu,negatif
https://www.tokopedia.com/electrocom/lenovo-thinkpad-x280-touchscreen-i5-gen8-ram-16gb-512gb-ultrabook-1733657196012995842/review,Habibah,"Garansinya hoax. chat komplen tgl 30 'ssd ga terbaca' oleh laptopnya. slow respon akhirnya balas tgl 3 bilangnya garansi habis. padahal mau disamperin tokonya


h...","garansinya hoax chat komplen tgl  ssd ga terbaca oleh laptopnya slow respon akhirnya balas tgl  bilangnya garansi habis padahal mau disamperin tokonya


h",1,Lebih dari 1 tahun lalu,negatif
https://www.tokopedia.com/electrocom/lenovo-thinkpad-x280-touchscreen-i5-gen8-ram-16gb-512gb-ultrabook-1733657196012995842/review,Yoga,"ada sedikit minus di casing penyok masuk kecil di beberapa titik,dan ada whitespot/panu kecil di tengah layar",ada sedikit minus di casing penyok masuk kecil di beberapa titikdan ada whitespotpanu kecil di tengah layar,2,9 bulan lalu,negatif
https://www.tokopedia.com/electrocom/lenovo-thinkpad-x280-touchscreen-i5-gen8-ram-16gb-512gb-ultrabook-1733657196012995842/review,Dimas,Lebih dari 1 tahun lalu,lebih dari  tahun lalu,2,Lebih dari 1 tahun lalu,negatif
https://www.tokopedia.com/electrocom/lenovo-thinkpad-x280-touchscreen-i5-gen8-ram-16gb-512gb-ultrabook-1733657196012995842/review,a***r,"Barang hilang di jalan, penjual dan jasa pengiriman lambat responnya. 3 minggu yang sia-sia",barang hilang di jalan penjual dan jasa pengiriman lambat responnya  minggu yang siasia,3,Lebih dari 1 tahun lalu,netral
https://www.tokopedia.com/electrocom/lenovo-thinkpad-x280-touchscreen-i5-gen8-ram-16gb-512gb-ultrabook-1733657196012995842/review,Nazihun,key pad sering loncat di ketik,key pad sering loncat di ketik,3,Lebih dari 1 tahun lalu,netral
https://www.tokopedia.com/foxcomp/lenovo-thinkpad-t480-core-i7-8th-gen-ram-16gb-ssd-256gb-core-i5-8250u-ram-8-ssd-128-7639c/review,Vera,"barangnya tidak lengkap seperti gambar yg saya lampirkan, infonya bisa dikirimkan kekurangan barang yg tdk lengkap. benar memang dikirim tp saya yang bayar pdhl itu bukan...",barangnya tidak lengkap seperti gambar yg saya lampirkan infonya bisa dikirimkan kekurangan barang yg tdk lengkap benar memang dikirim tp saya yang bayar pdhl itu bukan,1,Lebih dari 1 tahun lalu,negatif
https://www.tokopedia.com/foxcomp/lenovo-thinkpad-t480-core-i7-8th-gen-ram-16gb-ssd-256gb-core-i5-8250u-ram-8-ssd-128-7639c/review,S***o,"Baterai drop, sudah dicoba beberapa kali dicas sampai full tetap aja ga bisa tahan lama, dipakai ga sampai 20 menit lgsg mati",baterai drop sudah dicoba beberapa kali dicas sampai full tetap aja ga bisa tahan lama dipakai ga sampai  menit lgsg mati,2,9 bulan lalu,negatif
https://www.tokopedia.com/foxcomp/lenovo-thinkpad-t480-core-i7-8th-gen-ram-16gb-ssd-256gb-core-i5-8250u-ram-8-ssd-128-7639c/review,Abdul,"secara fisik barang oke, packing juga bagus, 9/10 lah

tapi fatal di hardware yg masih terhubung dengan autopilot perusahaan lamanya. ketika ditanya ke seller perihal hal...","secara fisik barang oke packing juga bagus  lah

tapi fatal di hardware yg masih terhubung dengan autopilot perusahaan lamanya ketika ditanya ke seller perihal hal",3,Lebih dari 1 tahun lalu,netral
https://www.tokopedia.com/foxcomp/lenovo-thinkpad-t480-core-i7-8th-gen-ram-16gb-ssd-256gb-core-i5-8250u-ram-8-ssd-128-7639c/review,A***s,"Laptopnya bagus, cuma adaptor chargernya yang tidak sesuai dengan deskripsi / tidak original lagi. saat pengecasan bunyi krek-krek di adaptornya.",laptopnya bagus cuma adaptor chargernya yang tidak sesuai dengan deskripsi  tidak original lagi saat pengecasan bunyi krekkrek di adaptornya,3,Lebih dari 1 tahun lalu,netral
https://www.tokopedia.com/start-comp/lenovo-thinkpad-t480s-core-i5-gen-8-ram-16gb-ssd-256gb-tipis-ringan-1731865619799049234/review,Akhfi,"produk kacau . kursor jalan sendiri, minta yg touch d kirim yg biasa, tombol2 macet, ada yg gak bsa d pencet. parah bgt pokoknya.",produk kacau  kursor jalan sendiri minta yg touch d kirim yg biasa tombol macet ada yg gak bsa d pencet parah bgt pokoknya,1,10 bulan lalu,negatif
https://www.tokopedia.com/start-comp/lenovo-thinkpad-t480s-core-i5-gen-8-ram-16gb-ssd-256gb-tipis-ringan-1731865619799049234/review,A***f,Tidak bisa nyala. RIP qc sebelum dikirim.,tidak bisa nyala rip qc sebelum dikirim,1,Lebih dari 1 tahun lalu,negatif
https://www.tokopedia.com/start-comp/lenovo-thinkpad-t480s-core-i5-gen-8-ram-16gb-ssd-256gb-tipis-ringan-1731865619799049234/review,steven,Lebih dari 1 tahun lalu,lebih dari  tahun lalu,1,Lebih dari 1 tahun lalu,negatif
https://www.tokopedia.com/start-comp/lenovo-thinkpad-t480s-core-i5-gen-8-ram-16gb-ssd-256gb-tipis-ringan-1731865619799049234/review,M***l,"minus: 
-pertama saya mau beli sudah suruh penjual mengabari kondisi barang tp engga dijawab.
- barang sampai hari pertama saya cek semua ternyata baterai cuma 1. sorenya...","minus 
pertama saya mau beli sudah suruh penjual mengabari kondisi barang tp engga dijawab
 barang sampai hari pertama saya cek semua ternyata baterai cuma  sorenya",2,Lebih dari 1 tahun lalu,negatif
https://www.tokopedia.com/start-comp/lenovo-thinkpad-t480s-core-i5-gen-8-ram-16gb-ssd-256gb-tipis-ringan-1731865619799049234/review,6 orang terbantu,"harusnya baterai ada 2, internal external
yang dikirim ga ada internal,
harusnya 8350U, yang dikirim 8250U
penjual pura² ****","harusnya baterai ada  internal external
yang dikirim ga ada internal
harusnya u yang dikirim u
penjual pura²",2,Lebih dari 1 tahun lalu,negatif
https://www.tokopedia.com/start-comp/lenovo-thinkpad-t480s-core-i5-gen-8-ram-16gb-ssd-256gb-tipis-ringan-1731865619799049234/review,P***h,"lcd tidak tampil,",lcd tidak tampil,2,1 minggu lalu,negatif
https://www.tokopedia.com/foxcomp/laptop-lenovo-thinkpad-t490-core-i7-8565u-ram-32gb-full-hd-14-inch-t480-i5-gen-8-8gb-ssd-128-3115f/review,H***y,"Charger laptop terindikasi KW dgn tempelan sticker dari kertas menutupi SN. Pada hari ke-3 charger RUSAK, tidak dapat berfungsi sama sekali.
Saat retur, pengiriman oleh p...","charger laptop terindikasi kw dgn tempelan sticker dari kertas menutupi sn pada hari ke charger rusak tidak dapat berfungsi sama sekali
saat retur pengiriman oleh p",1,Lebih dari 1 tahun lalu,negatif
https://www.tokopedia.com/foxcomp/laptop-lenovo-thinkpad-t490-core-i7-8565u-ram-32gb-full-hd-14-inch-t480-i5-gen-8-8gb-ssd-128-3115f/review,I***l,"sangat menyesal beli disini, laptop pemakaian normal ga berat2 ,tapi malah tiba2 rusak hanya nyala keyboard nya aja, main board sampe kena, disuruh servis kestu, ditunggu...",sangat menyesal beli disini laptop pemakaian normal ga berat tapi malah tiba rusak hanya nyala keyboard nya aja main board sampe kena disuruh servis kestu ditunggu,1,8 bulan lalu,negatif
https://www.tokopedia.com/foxcomp/laptop-lenovo-thinkpad-t490-core-i7-8565u-ram-32gb-full-hd-14-inch-t480-i5-gen-8-8gb-ssd-128-3115f/review,Kiagus,"Pengiriman lama, sampai diambil sendiri ke tempat ekspedisinya, Laptop keyboard banyak bekas lem dan minyak, layar penuh dengan serbuk seperti pasir...kelengkapan BONUS M...",pengiriman lama sampai diambil sendiri ke tempat ekspedisinya laptop keyboard banyak bekas lem dan minyak layar penuh dengan serbuk seperti pasirkelengkapan bonus m,2,Lebih dari 1 tahun lalu,negatif
https://www.tokopedia.com/foxcomp/laptop-lenovo-thinkpad-t490-core-i7-8565u-ram-32gb-full-hd-14-inch-t480-i5-gen-8-8gb-ssd-128-3115f/review,B***i,"charger kabel AC laptop tidak berfungsi, terpaksa beli lagi dan baut ada yg tidak terpasang, untuk laptop secara penggunaan sudah lumayan",charger kabel ac laptop tidak berfungsi terpaksa beli lagi dan baut ada yg tidak terpasang untuk laptop secara penggunaan sudah lumayan,2,Lebih dari 1 tahun lalu,negatif
https://www.tokopedia.com/foxcomp/laptop-lenovo-thinkpad-t490-core-i7-8565u-ram-32gb-full-hd-14-inch-t480-i5-gen-8-8gb-ssd-128-3115f/review,Gilang,apesan touchscreen yang datang gg touchscreen,apesan touchscreen yang datang gg touchscreen,3,5 bulan lalu,netral
https://www.tokopedia.com/foxcomp/laptop-lenovo-thinkpad-t490-core-i7-8565u-ram-32gb-full-hd-14-inch-t480-i5-gen-8-8gb-ssd-128-3115f/review,A***n,touchscreen nya suka tap tap sendiri eror gitu jadi harus restart dulu baru ngga tap tap sendiri,touchscreen nya suka tap tap sendiri eror gitu jadi harus restart dulu baru ngga tap tap sendiri,3,8 bulan lalu,netral
https://www.tokopedia.com/foxcomp/laptop-lenovo-thinkpad-t490-core-i7-8565u-ram-32gb-full-hd-14-inch-t480-i5-gen-8-8gb-ssd-128-3115f/review,Muhammad,Barang di return ke penjual karena tidak sesuai dengan pemesanan. Tapi respon penjual sangat baik dan amanah 👍,barang di return ke penjual karena tidak sesuai dengan pemesanan tapi respon penjual sangat baik dan amanah,3,Lebih dari 1 tahun lalu,netral
https://www.tokopedia.com/foxcomp/laptop-lenovo-thinkpad-t490-core-i7-8565u-ram-32gb-full-hd-14-inch-t480-i5-gen-8-8gb-ssd-128-3115f/review,Riza,Lebih dari 1 tahun lalu,lebih dari  tahun lalu,3,Lebih dari 1 tahun lalu,netral
https://www.tokopedia.com/globallaptopthinkpad/laptop-lenovo-thinkpad-t460-t460s-intel-i5-i7-gen-6-ram-4-8-gb-ssd-t460p-i5-6-4gb-ssd-128gb-500b6/review,U***n,"laptop nya tidak sesuai deskripsi. kata admin nya DOUBLE VGA,kemudian saya beli. Eh.. dikirim nya BUKAN DOUBLE VGA. Terus di iklannya KEYBOARD BACKLIGHT,eh.. Dikirimnya K...",laptop nya tidak sesuai deskripsi kata admin nya double vgakemudian saya beli eh dikirim nya bukan double vga terus di iklannya keyboard backlighteh dikirimnya k,1,3 minggu lalu,negatif
https://www.tokopedia.com/globallaptopthinkpad/laptop-lenovo-thinkpad-t460-t460s-intel-i5-i7-gen-6-ram-4-8-gb-ssd-t460p-i5-6-4gb-ssd-128gb-500b6/review,Wandy,"3 kali belanja disini, tidak membuat kita jadi prioritas, makin di perlambat proses pengirimannya",kali belanja disini tidak membuat kita jadi prioritas makin di perlambat proses pengirimannya,1,Lebih dari 1 tahun lalu,negatif
https://www.tokopedia.com/globallaptopthinkpad/laptop-lenovo-thinkpad-t460-t460s-intel-i5-i7-gen-6-ram-4-8-gb-ssd-t460p-i5-6-4gb-ssd-128gb-500b6/review,Wandy,Pengiriman lambat diproses,pengiriman lambat diproses,1,Lebih dari 1 tahun lalu,negatif
https://www.tokopedia.com/globallaptopthinkpad/laptop-lenovo-thinkpad-t460-t460s-intel-i5-i7-gen-6-ram-4-8-gb-ssd-t460p-i5-6-4gb-ssd-128gb-500b6/review,steven,"barang OK,  kualitas barang OK, cuma kecewa sama kesepakatan di awal yg tidak terealisasi, reques windows lewat chat di bilang bisa. reques microsoft office dibilang bisa...",barang ok  kualitas barang ok cuma kecewa sama kesepakatan di awal yg tidak terealisasi reques windows lewat chat di bilang bisa reques microsoft office dibilang bisa,3,Lebih dari 1 tahun lalu,netral
https://www.tokopedia.com/us-electronic/spesial-laptop-lenovo-thinkpad-l380-yoga-touchscreen-ram-32gb-1tb-sssd-fullset-1733568718572520577/review,Toserba,"sdh belanja kedua kalinya malah barang bermasalah pdahal deskripsi nya barang semua di cek, hanya krna 1 kesalahan jdi pikir ulang mau beli disini lagi",sdh belanja kedua kalinya malah barang bermasalah pdahal deskripsi nya barang semua di cek hanya krna  kesalahan jdi pikir ulang mau beli disini lagi,1,Lebih dari 1 tahun lalu,negatif
https://www.tokopedia.com/us-electronic/spesial-laptop-lenovo-thinkpad-l380-yoga-touchscreen-ram-32gb-1tb-sssd-fullset-1733568718572520577/review,I***n,"yang dibutuhkan pembeli adalah kejujuran penjual dalam menjual barang, kalau misalkan barang yg dijual diatas 90 persen ya kasih diatas 90 persen, saya pikir sikap profes...",yang dibutuhkan pembeli adalah kejujuran penjual dalam menjual barang kalau misalkan barang yg dijual diatas  persen ya kasih diatas  persen saya pikir sikap profes,1,Lebih dari 1 tahun lalu,negatif
https://www.tokopedia.com/us-electronic/spesial-laptop-lenovo-thinkpad-l380-yoga-touchscreen-ram-32gb-1tb-sssd-fullset-1733568718572520577/review,Aprilius,Barang rusak kok dikirim bos bos,barang rusak kok dikirim bos bos,1,Lebih dari 1 tahun lalu,negatif
https://www.tokopedia.com/us-electronic/spesial-laptop-lenovo-thinkpad-l380-yoga-touchscreen-ram-32gb-1tb-sssd-fullset-1733568718572520577/review,H***r,"yang di kirim tidak sesuai dengan deskripsi
malah saat di install ulang hdd masih ada file di dalam nya dan ada virus nya
, jangan beli di sini kecewa berat saya","yang di kirim tidak sesuai dengan deskripsi
malah saat di install ulang hdd masih ada file di dalam nya dan ada virus nya
 jangan beli di sini kecewa berat saya",1,Lebih dari 1 tahun lalu,negatif
