Source_URL,Username,Review,Cleaned_Review,Rating,Date,Sentiment
https://www.tokopedia.com/sinarmulia/lenovo-ideapad-slim-3i-i5-13420h-512gb-ssd-8gb-16gb-wuxga-ips-win11-ohs-1731539518315071263/review,T***S,kurang cakap menangani masalah konsumen,kurang cakap menangani masalah konsumen,2,10 bulan lalu,negatif
https://www.tokopedia.com/wei-1/acer-aspire-lite-14-al14-31p-intel-n100-8gb-256gb-512gb-ssd-14-wuxga-ips-w11-ohs-1731240630630909403/review,Aisyah,"barang ada 1 dot merah, 1 dot putih. acer tipe ini saya sudah pernah 2 Kali kena layar ada dot. dan tidak bisa klaim.",barang ada  dot merah  dot putih acer tipe ini saya sudah pernah  kali kena layar ada dot dan tidak bisa klaim,1,Lebih dari 1 tahun lalu,negatif
https://www.tokopedia.com/wei-1/acer-aspire-lite-14-al14-31p-intel-n100-8gb-256gb-512gb-ssd-14-wuxga-ips-w11-ohs-1731240630630909403/review,steven,barang nya sudah di bawa ke service center acer yg berada di tanggerang sudah 2 kali dan di saran kan untuk di tukar garansi masih berlaku bagaimana cara menukar nya? ter...,barang nya sudah di bawa ke service center acer yg berada di tanggerang sudah  kali dan di saran kan untuk di tukar garansi masih berlaku bagaimana cara menukar nya ter,2,Lebih dari 1 tahun lalu,negatif
https://www.tokopedia.com/protechcom/asus-vivobook-14-a1404va-i3-1315u-8gb-512gb-14-fhd-ohs-w11-ddr4-8gb-05e3e/review,Yosep,Lebih dari 1 tahun lalu,lebih dari  tahun lalu,1,Lebih dari 1 tahun lalu,negatif
https://www.tokopedia.com/protechcom/asus-vivobook-14-a1404va-i3-1315u-8gb-512gb-14-fhd-ohs-w11-ddr4-8gb-05e3e/review,Muhammad,"paket di terima dalam keadaan kurang rapih, buble warp da yg bolong tmbus sampe ke kardus depan laptop, untung tidak sampai ke laptopnya,,, mgkin gara2 tidak di kasih tan...",paket di terima dalam keadaan kurang rapih buble warp da yg bolong tmbus sampe ke kardus depan laptop untung tidak sampai ke laptopnya mgkin gara tidak di kasih tan,3,Lebih dari 1 tahun lalu,netral
https://www.tokopedia.com/protechcom/asus-vivobook-14-a1404va-i3-1315u-8gb-512gb-14-fhd-ohs-w11-ddr4-8gb-05e3e/review,N***l,"Maaf saya kasi bintang nya segitu, masih jengkel sama pelayanannya. Sudah order katanya sudah dikirim hari itu juga, ternyata pas dilacak belum dikirim terus chat ke admi...",maaf saya kasi bintang nya segitu masih jengkel sama pelayanannya sudah order katanya sudah dikirim hari itu juga ternyata pas dilacak belum dikirim terus chat ke admi,3,Lebih dari 1 tahun lalu,netral
https://www.tokopedia.com/protechcom/asus-vivobook-14-a1404va-i3-1315u-8gb-512gb-14-fhd-ohs-w11-ddr4-8gb-05e3e/review,R***t,"Kendala: Pelayanan penjual kurang, Pengiriman lama",kendala pelayanan penjual kurang pengiriman lama,3,6 bulan lalu,netral
https://www.tokopedia.com/gaminglaptopid/laptop-asus-zenbook-14-oled-um3406ha-touch-amd-ryzen-7-8840hs-16gb-512gb-windows-11-14-inch-1731200295547995755/review,Iriawan,"barang sesuai dan ok, pengiriman lama",barang sesuai dan ok pengiriman lama,3,Lebih dari 1 tahun lalu,netral
https://www.tokopedia.com/collinsofficial/apple-macbook-air-m4-2025-13-inch-16-256gb-16-512gb-24-512gb-gpu-8core-10core-resmi-ibox-1733912388791993543/review,Membantu,"sebenernya barang ga ada kendala, cuma respon dari seller bener bener parah banget, dichat susah kebanyakan botnya, ngasih alamat ga jelas diputer”, slowresp janji mau ki...",sebenernya barang ga ada kendala cuma respon dari seller bener bener parah banget dichat susah kebanyakan botnya ngasih alamat ga jelas diputer slowresp janji mau ki,1,3 minggu lalu,negatif
https://www.tokopedia.com/collinsofficial/apple-macbook-air-m4-2025-13-inch-16-256gb-16-512gb-24-512gb-gpu-8core-10core-resmi-ibox-1733912388791993543/review,B***e,a fraud seller. hati hati beli toko ini. kirimnya beda warna. tp penjual tidak mau retur dan tidak ada respon.,a fraud seller hati hati beli toko ini kirimnya beda warna tp penjual tidak mau retur dan tidak ada respon,1,2 bulan lalu,negatif
https://www.tokopedia.com/collinsofficial/apple-macbook-air-m4-2025-13-inch-16-256gb-16-512gb-24-512gb-gpu-8core-10core-resmi-ibox-1733912388791993543/review,alodia,Kendala: Pelayanan penjual kurang,kendala pelayanan penjual kurang,2,4 bulan lalu,negatif
https://www.tokopedia.com/collinsofficial/apple-macbook-air-m4-2025-13-inch-16-256gb-16-512gb-24-512gb-gpu-8core-10core-resmi-ibox-1733912388791993543/review,Rangga,"agak kecewa sih seller katanya charger 70w, taunya yang ada 30w doang.. kotaknya jg agak kotor tapi okelah sisanya",agak kecewa sih seller katanya charger w taunya yang ada w doang kotaknya jg agak kotor tapi okelah sisanya,3,5 bulan lalu,netral
https://www.tokopedia.com/collinsofficial/apple-macbook-air-m4-2025-13-inch-16-256gb-16-512gb-24-512gb-gpu-8core-10core-resmi-ibox-1733912388791993543/review,A***t,Mohon ditingkatkan pelayanan nya,mohon ditingkatkan pelayanan nya,3,7 bulan lalu,netral
https://www.tokopedia.com/distri-laptop/axioo-mybook-hype-5-amd-ryzen-5-ram-8gb-256gb-ssd-14-fhd-win11-1731441317863720461/review,F***n,"hati hati yang mau beli laptop disini, dapet barang yang ga 100% baru. laptop datang dengan keadaan baret baret dan juga KOTOR. udah di komplain retur barang kirain bakal...",hati hati yang mau beli laptop disini dapet barang yang ga  baru laptop datang dengan keadaan baret baret dan juga kotor udah di komplain retur barang kirain bakal,1,Lebih dari 1 tahun lalu,negatif
https://www.tokopedia.com/distri-laptop/axioo-mybook-hype-5-amd-ryzen-5-ram-8gb-256gb-ssd-14-fhd-win11-1731441317863720461/review,basril,"JANGAN PERNAH MEMBELI DI TOKO INI. 
Pertama kalinya kecewa bertransaksi di Tokopedia seperti ini. judul iklan dan deskripsi mengatakan CPU yang digunakan Ryzen 5500U. set...","jangan pernah membeli di toko ini 
pertama kalinya kecewa bertransaksi di tokopedia seperti ini judul iklan dan deskripsi mengatakan cpu yang digunakan ryzen u set",1,Lebih dari 1 tahun lalu,negatif
https://www.tokopedia.com/distri-laptop/axioo-mybook-hype-5-amd-ryzen-5-ram-8gb-256gb-ssd-14-fhd-win11-1731441317863720461/review,P***o,parahhh nihhh tokoo pesannn nyaa apaa tang di kirim apaa ga sesuaii samaa sekalii tambaa lagii responnya ga baikk,parahhh nihhh tokoo pesannn nyaa apaa tang di kirim apaa ga sesuaii samaa sekalii tambaa lagii responnya ga baikk,1,5 bulan lalu,negatif
https://www.tokopedia.com/distri-laptop/axioo-mybook-hype-5-amd-ryzen-5-ram-8gb-256gb-ssd-14-fhd-win11-1731441317863720461/review,W***o,"spek di judul dan deskripsi berbeda, ketika ditanya seakan kesalahan pembeli karena tidak baca deskripsi.
meskipun laptop entry level, bukan termasuk penjual yang baik.","spek di judul dan deskripsi berbeda ketika ditanya seakan kesalahan pembeli karena tidak baca deskripsi
meskipun laptop entry level bukan termasuk penjual yang baik",1,Lebih dari 1 tahun lalu,negatif
https://www.tokopedia.com/distri-laptop/axioo-mybook-hype-5-amd-ryzen-5-ram-8gb-256gb-ssd-14-fhd-win11-1731441317863720461/review,Membantu,pengiriman cepat tapi after sales nya kurang bangettt,pengiriman cepat tapi after sales nya kurang bangettt,2,Lebih dari 1 tahun lalu,negatif
https://www.tokopedia.com/distri-laptop/axioo-mybook-hype-5-amd-ryzen-5-ram-8gb-256gb-ssd-14-fhd-win11-1731441317863720461/review,R***a,Lebih dari 1 tahun lalu,lebih dari  tahun lalu,2,Lebih dari 1 tahun lalu,negatif
https://www.tokopedia.com/distri-laptop/axioo-mybook-hype-5-amd-ryzen-5-ram-8gb-256gb-ssd-14-fhd-win11-1731441317863720461/review,59 orang terbantu,"spesifikasi lumayan bagus, fitur okelah, tapi sayangnya ga ada DVD ROM nya. padahal laptop yg lama yg ukuran 14 Inch biasanya sudah dilengkapi DVD ROM. untuk yg mo beli,...",spesifikasi lumayan bagus fitur okelah tapi sayangnya ga ada dvd rom nya padahal laptop yg lama yg ukuran  inch biasanya sudah dilengkapi dvd rom untuk yg mo beli,3,Lebih dari 1 tahun lalu,netral
https://www.tokopedia.com/distri-laptop/axioo-mybook-hype-5-amd-ryzen-5-ram-8gb-256gb-ssd-14-fhd-win11-1731441317863720461/review,T***n,"Barang yg di kirimkan tdk sesuai, belinya axio hype5 amd x5 yg datang axio hype5amd x3... Minta tolong pengembalian dana selisih dari harga x5 ke x3",barang yg di kirimkan tdk sesuai belinya axio hype amd x yg datang axio hypeamd x minta tolong pengembalian dana selisih dari harga x ke x,3,3 bulan lalu,netral
https://www.tokopedia.com/distri-laptop/axioo-mybook-hype-5-amd-ryzen-5-ram-8gb-256gb-ssd-14-fhd-win11-1731441317863720461/review,A***h,yang dikirim Ryzen 5 3500U tidak sesuai deskripsi,yang dikirim ryzen  u tidak sesuai deskripsi,3,Lebih dari 1 tahun lalu,netral
https://www.tokopedia.com/oceanla/laptop-lenovo-thinkpad-t460s-t470s-intel-i5-i7-ram-20gb-murah-bergaransi-1733509135021213476/review,C***a,"saya kecewa dengan seller karena dari awal sebelum saya order barang, saya sudah bertanya dan meminta untuk keyboard US dan Backlight tapi yg dikirim justru keyboard yg t...",saya kecewa dengan seller karena dari awal sebelum saya order barang saya sudah bertanya dan meminta untuk keyboard us dan backlight tapi yg dikirim justru keyboard yg t,1,Lebih dari 1 tahun lalu,negatif
https://www.tokopedia.com/oceanla/laptop-lenovo-thinkpad-t460s-t470s-intel-i5-i7-ram-20gb-murah-bergaransi-1733509135021213476/review,S***a,Maaf saya ganti baru dipakai 1 bulan keybord sudah eror tidak berfungsi sebagian,maaf saya ganti baru dipakai  bulan keybord sudah eror tidak berfungsi sebagian,1,Lebih dari 1 tahun lalu,negatif
https://www.tokopedia.com/oceanla/laptop-lenovo-thinkpad-t460s-t470s-intel-i5-i7-ram-20gb-murah-bergaransi-1733509135021213476/review,Tomy,saya pribadi lebih akan cari lapak lain.  produk touchpad bermasalah klik kanan rusak. komplain di layani sangat lelet. untuk yang mau order silakan  coba sendiri sendiri...,saya pribadi lebih akan cari lapak lain  produk touchpad bermasalah klik kanan rusak komplain di layani sangat lelet untuk yang mau order silakan  coba sendiri sendiri,1,Lebih dari 1 tahun lalu,negatif
https://www.tokopedia.com/oceanla/laptop-lenovo-thinkpad-t460s-t470s-intel-i5-i7-ram-20gb-murah-bergaransi-1733509135021213476/review,N***r,"udah 2x beli disini, tapi 2x juga enggak dapat tas, 
sampai sekarang belum nyampe2 tas nya, katanya sudah di kirim, dan sempet bluescren dan speaker rusak","udah x beli disini tapi x juga enggak dapat tas 
sampai sekarang belum nyampe tas nya katanya sudah di kirim dan sempet bluescren dan speaker rusak",1,Lebih dari 1 tahun lalu,negatif
https://www.tokopedia.com/oceanla/laptop-lenovo-thinkpad-t460s-t470s-intel-i5-i7-ram-20gb-murah-bergaransi-1733509135021213476/review,Erlis,barang tidak sampai.....,barang tidak sampai,1,Lebih dari 1 tahun lalu,negatif
https://www.tokopedia.com/oceanla/laptop-lenovo-thinkpad-t460s-t470s-intel-i5-i7-ram-20gb-murah-bergaransi-1733509135021213476/review,Hizam,normal aja..barang 80 persen lah ..andai dapat yg lebih bagus dan utuh,normal ajabarang  persen lah andai dapat yg lebih bagus dan utuh,2,Lebih dari 1 tahun lalu,negatif
https://www.tokopedia.com/oceanla/laptop-lenovo-thinkpad-t460s-t470s-intel-i5-i7-ram-20gb-murah-bergaransi-1733509135021213476/review,Regitaa,sebenernya puas banget sama barangnya. tapi kecewa banget sama sellernya yang banyak omong dan ngebohongi customer mengenai pengiriman. bilangnya udah dikirim nyalah nyal...,sebenernya puas banget sama barangnya tapi kecewa banget sama sellernya yang banyak omong dan ngebohongi customer mengenai pengiriman bilangnya udah dikirim nyalah nyal,2,Lebih dari 1 tahun lalu,negatif
https://www.tokopedia.com/oceanla/laptop-lenovo-thinkpad-t460s-t470s-intel-i5-i7-ram-20gb-murah-bergaransi-1733509135021213476/review,v***r,keyboard nya non US.. seller gak pake confirm kalo kirim ya kirim aja..,keyboard nya non us seller gak pake confirm kalo kirim ya kirim aja,2,Lebih dari 1 tahun lalu,negatif
https://www.tokopedia.com/oceanla/laptop-lenovo-thinkpad-x270-x260-x250-x240-x230-ram-16gb-ssd-1tb-ultrabook-murah-1733484675192293156/review,W***n,"cukup sudah kecewa.. body di lem korea.
kabel wifi tidak terpasang.","cukup sudah kecewa body di lem korea
kabel wifi tidak terpasang",1,Lebih dari 1 tahun lalu,negatif
https://www.tokopedia.com/oceanla/laptop-lenovo-thinkpad-x270-x260-x250-x240-x230-ram-16gb-ssd-1tb-ultrabook-murah-1733484675192293156/review,m***d,"mouse pad suka error, tombol keyboard @ dan "" Ketukar tempat",mouse pad suka error tombol keyboard  dan  ketukar tempat,1,Lebih dari 1 tahun lalu,negatif
https://www.tokopedia.com/oceanla/laptop-lenovo-thinkpad-x270-x260-x250-x240-x230-ram-16gb-ssd-1tb-ultrabook-murah-1733484675192293156/review,Kasmanto,"Casing Notebook tidak rapat, Barang tidak sesuai expetasi",casing notebook tidak rapat barang tidak sesuai expetasi,1,Lebih dari 1 tahun lalu,negatif
https://www.tokopedia.com/oceanla/laptop-lenovo-thinkpad-x270-x260-x250-x240-x230-ram-16gb-ssd-1tb-ultrabook-murah-1733484675192293156/review,Satriardi,merugikan org lain,merugikan org lain,1,Lebih dari 1 tahun lalu,negatif
https://www.tokopedia.com/oceanla/laptop-lenovo-thinkpad-x270-x260-x250-x240-x230-ram-16gb-ssd-1tb-ultrabook-murah-1733484675192293156/review,M***r,Sy claim garansi katanya SSD bermasalah. Katanya ud diganti ternyata sy cek blm diganti dan error lagi,sy claim garansi katanya ssd bermasalah katanya ud diganti ternyata sy cek blm diganti dan error lagi,2,Lebih dari 1 tahun lalu,negatif
https://www.tokopedia.com/oceanla/laptop-lenovo-thinkpad-x270-x260-x250-x240-x230-ram-16gb-ssd-1tb-ultrabook-murah-1733484675192293156/review,DIMITRI,msih gk layak dpet bintang 5 !!,msih gk layak dpet bintang,2,Lebih dari 1 tahun lalu,negatif
https://www.tokopedia.com/oceanla/laptop-lenovo-thinkpad-x270-x260-x250-x240-x230-ram-16gb-ssd-1tb-ultrabook-murah-1733484675192293156/review,Kasmanto,tidak sesuai expetasi,tidak sesuai expetasi,2,Lebih dari 1 tahun lalu,negatif
https://www.tokopedia.com/oceanla/laptop-lenovo-thinkpad-x270-x260-x250-x240-x230-ram-16gb-ssd-1tb-ultrabook-murah-1733484675192293156/review,Agung,"Setelah pas satu bulan pemakaian, keyboard error dan garansi pas habiss, agak kecewa si.",setelah pas satu bulan pemakaian keyboard error dan garansi pas habiss agak kecewa si,3,Lebih dari 1 tahun lalu,netral
https://www.tokopedia.com/oceanla/laptop-lenovo-thinkpad-x270-x260-x250-x240-x230-ram-16gb-ssd-1tb-ultrabook-murah-1733484675192293156/review,Iqbal,"review setelah satu bulan , fisik laptop masih dalam keadaan baik , ssd harus ganti karna masalah bluescreen, adaptor harus beli baru karna bermasalah",review setelah satu bulan  fisik laptop masih dalam keadaan baik  ssd harus ganti karna masalah bluescreen adaptor harus beli baru karna bermasalah,3,Lebih dari 1 tahun lalu,netral
https://www.tokopedia.com/oceanla/laptop-lenovo-thinkpad-x270-x260-x250-x240-x230-ram-16gb-ssd-1tb-ultrabook-murah-1733484675192293156/review,P***k,Lebih dari 1 tahun lalu,lebih dari  tahun lalu,3,Lebih dari 1 tahun lalu,netral
https://www.tokopedia.com/decacom/asus-vivobook-s15-oled-ultra-9-185h-ultra-7-155h-16gb-1tb-w11-15-qhd-3k-s5506ma-1732723078640732127/review,Hari,"Saat chat dg penjual  barang ditawarkan. Setelah diorder, barang tak ikut dikirim, tanpa pemberitahuan. Setelah ditanyakan bilang stock habis, uang mau di refund.",saat chat dg penjual  barang ditawarkan setelah diorder barang tak ikut dikirim tanpa pemberitahuan setelah ditanyakan bilang stock habis uang mau di refund,1,Lebih dari 1 tahun lalu,negatif
https://www.tokopedia.com/decacom/asus-vivobook-s15-oled-ultra-9-185h-ultra-7-155h-16gb-1tb-w11-15-qhd-3k-s5506ma-1732723078640732127/review,A***D,"Pembersihnya ga dikirim-kirim, karanya mau dikirim, hadeuh.",pembersihnya ga dikirimkirim karanya mau dikirim hadeuh,1,Lebih dari 1 tahun lalu,negatif
https://www.tokopedia.com/decacom/asus-vivobook-s15-oled-ultra-9-185h-ultra-7-155h-16gb-1tb-w11-15-qhd-3k-s5506ma-1732723078640732127/review,amirullah,"promo paket gak lengkap, antara deskripsi, nota dan barang yg diterima gak sesuai, pengiriman barang yg tidak terkirim nanti2 dan tetep juga gak lengkap, seller respon ja...",promo paket gak lengkap antara deskripsi nota dan barang yg diterima gak sesuai pengiriman barang yg tidak terkirim nanti dan tetep juga gak lengkap seller respon ja,2,Lebih dari 1 tahun lalu,negatif
https://www.tokopedia.com/decacom/asus-vivobook-s15-oled-ultra-9-185h-ultra-7-155h-16gb-1tb-w11-15-qhd-3k-s5506ma-1732723078640732127/review,ANDI,Pesanan tdk lengkap. Ada yg tdk terkirim,pesanan tdk lengkap ada yg tdk terkirim,2,Lebih dari 1 tahun lalu,negatif
https://www.tokopedia.com/decacom/asus-vivobook-s15-oled-ultra-9-185h-ultra-7-155h-16gb-1tb-w11-15-qhd-3k-s5506ma-1732723078640732127/review,S***a,lebih baik dipasangkan toko. Pasang sendiri kurang rapi. Barang datang masih harus potong,lebih baik dipasangkan toko pasang sendiri kurang rapi barang datang masih harus potong,3,Lebih dari 1 tahun lalu,netral
https://www.tokopedia.com/decacom/asus-vivobook-s15-oled-ultra-9-185h-ultra-7-155h-16gb-1tb-w11-15-qhd-3k-s5506ma-1732723078640732127/review,Y***a,sikat pembersih diganti cotton bud,sikat pembersih diganti cotton bud,3,Lebih dari 1 tahun lalu,netral
https://www.tokopedia.com/decacom/asus-vivobook-s15-oled-ultra-9-185h-ultra-7-155h-16gb-1tb-w11-15-qhd-3k-s5506ma-1732723078640732127/review,Imam,"lumayan, tapi tidak terbaik. penutup keybordnya gak jelas",lumayan tapi tidak terbaik penutup keybordnya gak jelas,3,Lebih dari 1 tahun lalu,netral
https://www.tokopedia.com/decacom/asus-vivobook-s15-oled-ultra-9-185h-ultra-7-155h-16gb-1tb-w11-15-qhd-3k-s5506ma-1732723078640732127/review,A***a,"Maaf gak bintang penuh karena pengerjaannya kurang rapi, masih banyak gelembung udara",maaf gak bintang penuh karena pengerjaannya kurang rapi masih banyak gelembung udara,3,Lebih dari 1 tahun lalu,netral
https://www.tokopedia.com/wdcomputer/wd-computer-lenovo-thinkpad-x270-intel-core-i5-gen-7-ram-8gb-ssd-128gb-layar-12-5-inch-garansi-30-hari-bonus-tas-laptop-mouse-wireless-aplikasi-kantor-1733035942694126786/review,H***n,"di deskripsi tertera + Dual Batrai normal tapi setelah 2 hari baterai tidak support, katanya dapat tas juga ternyata tidak tapi bukan itu masalahnya, masalahnya adalah la...",di deskripsi tertera  dual batrai normal tapi setelah  hari baterai tidak support katanya dapat tas juga ternyata tidak tapi bukan itu masalahnya masalahnya adalah la,2,Lebih dari 1 tahun lalu,negatif
https://www.tokopedia.com/wdcomputer/wd-computer-lenovo-thinkpad-x270-intel-core-i5-gen-7-ram-8gb-ssd-128gb-layar-12-5-inch-garansi-30-hari-bonus-tas-laptop-mouse-wireless-aplikasi-kantor-1733035942694126786/review,g***i,"Laptop yg satunya ada baut yg tidak rapat jadi ada tonjolan, overall barang bagus. Pengiriman cukup lama tpi masih masuk estimasi pengiriman, apa mungkin karena pakai kar...",laptop yg satunya ada baut yg tidak rapat jadi ada tonjolan overall barang bagus pengiriman cukup lama tpi masih masuk estimasi pengiriman apa mungkin karena pakai kar,3,5 bulan lalu,netral
https://www.tokopedia.com/electrocom/laptop-lenovo-thinkpad-t470-core-i5-gen7-ram-8gb-ssd-256gb-mulus-1733881974291989762/review,Ahmad,"Kecewa, pertama kali beli di sini malah apes 
lecetnya lumayan, 
saya tahu dikasing casing baru dan pemasangan tidak rapi, 
lcd juga framenya kurang nempel
-Pemasangan ke...","kecewa pertama kali beli di sini malah apes 
lecetnya lumayan 
saya tahu dikasing casing baru dan pemasangan tidak rapi 
lcd juga framenya kurang nempel
pemasangan ke",1,Lebih dari 1 tahun lalu,negatif
https://www.tokopedia.com/electrocom/laptop-lenovo-thinkpad-t470-core-i5-gen7-ram-8gb-ssd-256gb-mulus-1733881974291989762/review,Rudi,"baterainya cepat habis, barang bekas dikirim 
padahal sy belinya barang baru","baterainya cepat habis barang bekas dikirim 
padahal sy belinya barang baru",1,Lebih dari 1 tahun lalu,negatif
https://www.tokopedia.com/electrocom/laptop-lenovo-thinkpad-t470-core-i5-gen7-ram-8gb-ssd-256gb-mulus-1733881974291989762/review,Mikael,"adminnya tidak jelas, asal ngomong aja tanpa di cek barangnya, untung punya teman teknisi Laptop, biasa bantu perbaikinya, Kamp*et memang Adminnya.",adminnya tidak jelas asal ngomong aja tanpa di cek barangnya untung punya teman teknisi laptop biasa bantu perbaikinya kampet memang adminnya,1,Lebih dari 1 tahun lalu,negatif
https://www.tokopedia.com/electrocom/laptop-lenovo-thinkpad-t470-core-i5-gen7-ram-8gb-ssd-256gb-mulus-1733881974291989762/review,P***o,"Kualitas barang buruk,, battery 1 drop, battery 2 error,, body banyak bekas sticker, penjual tidak respon dan tidak komuniaktif,, sangat menyesal belanja di toko ini",kualitas barang buruk battery  drop battery  error body banyak bekas sticker penjual tidak respon dan tidak komuniaktif sangat menyesal belanja di toko ini,1,Lebih dari 1 tahun lalu,negatif
https://www.tokopedia.com/electrocom/laptop-lenovo-thinkpad-t470-core-i5-gen7-ram-8gb-ssd-256gb-mulus-1733881974291989762/review,Sigit,Setelah dipakai dlm masa garansi layar garis-garis. Diklaim garansi ke toko dan minta ganti layar tdk boleh. Sekarang layar masih masalah,setelah dipakai dlm masa garansi layar garisgaris diklaim garansi ke toko dan minta ganti layar tdk boleh sekarang layar masih masalah,1,2 bulan lalu,negatif
https://www.tokopedia.com/electrocom/laptop-lenovo-thinkpad-t470-core-i5-gen7-ram-8gb-ssd-256gb-mulus-1733881974291989762/review,yohannes,"batre Soak
settingan kecerahan tidak bisa
pokoknya tidak amanah
gosah jualan min kalau buat konsumen 
tidak puas
nyesal belinya","batre soak
settingan kecerahan tidak bisa
pokoknya tidak amanah
gosah jualan min kalau buat konsumen 
tidak puas
nyesal belinya",1,Lebih dari 1 tahun lalu,negatif
https://www.tokopedia.com/electrocom/laptop-lenovo-thinkpad-t470-core-i5-gen7-ram-8gb-ssd-256gb-mulus-1733881974291989762/review,Riki,"parah di pake belum 2 minggu aja udah matot ,padahal cuma di pake ringan browsing dan ngetik",parah di pake belum  minggu aja udah matot padahal cuma di pake ringan browsing dan ngetik,1,6 hari lalu,negatif
https://www.tokopedia.com/electrocom/laptop-lenovo-thinkpad-t470-core-i5-gen7-ram-8gb-ssd-256gb-mulus-1733881974291989762/review,LASIONO,Lebih dari 1 tahun lalu,lebih dari  tahun lalu,1,Lebih dari 1 tahun lalu,negatif
https://www.tokopedia.com/electrocom/laptop-lenovo-thinkpad-t470-core-i5-gen7-ram-8gb-ssd-256gb-mulus-1733881974291989762/review,8 orang terbantu,"tepat setelah masa garansi habis, error storage. setelah di cek ssd tidak terbaca.",tepat setelah masa garansi habis error storage setelah di cek ssd tidak terbaca,2,7 bulan lalu,negatif
https://www.tokopedia.com/electrocom/laptop-lenovo-thinkpad-t470-core-i5-gen7-ram-8gb-ssd-256gb-mulus-1733881974291989762/review,O***E,Lebih dari 1 tahun lalu,lebih dari  tahun lalu,2,Lebih dari 1 tahun lalu,negatif
https://www.tokopedia.com/electrocom/laptop-lenovo-thinkpad-t470-core-i5-gen7-ram-8gb-ssd-256gb-mulus-1733881974291989762/review,I***m,"Barang bagus, kondisi like new, cuma saya pesan yg ada fingerprint tapi yang dikirim tidak ada fingerprint, minta kompensasi tapi penjual tidak memberikan respon.",barang bagus kondisi like new cuma saya pesan yg ada fingerprint tapi yang dikirim tidak ada fingerprint minta kompensasi tapi penjual tidak memberikan respon,3,Lebih dari 1 tahun lalu,netral
https://www.tokopedia.com/electrocom/laptop-lenovo-thinkpad-t470-core-i5-gen7-ram-8gb-ssd-256gb-mulus-1733881974291989762/review,Abdul,"Sebelumnya selalu terima unit laptop dalam keadaan bersih kinclong, namun kali ini unit yg saya terima tampak kotor kusam belum dibersihkan maksimal. Unit normal.",sebelumnya selalu terima unit laptop dalam keadaan bersih kinclong namun kali ini unit yg saya terima tampak kotor kusam belum dibersihkan maksimal unit normal,3,Lebih dari 1 tahun lalu,netral
https://www.tokopedia.com/electrocom/laptop-lenovo-thinkpad-t470-core-i5-gen7-ram-8gb-ssd-256gb-mulus-1733881974291989762/review,Ahmad,"Spek manteb nih ,kondisi masih layak banget cuma ada bekas lem di cover nya
Respon pengiriman dari sellernya aja yg agak lama padahal instant dari pagi jam 9 tapi dikirim...","spek manteb nih kondisi masih layak banget cuma ada bekas lem di cover nya
respon pengiriman dari sellernya aja yg agak lama padahal instant dari pagi jam  tapi dikirim",3,Lebih dari 1 tahun lalu,netral
https://www.tokopedia.com/electrocom/laptop-lenovo-thinkpad-t470-core-i5-gen7-ram-8gb-ssd-256gb-mulus-1733881974291989762/review,N***n,"barang masih mulus...
tapi kurang teliti dlm QC nya...

keybord kurang beres jga tetap dikirim","barang masih mulus
tapi kurang teliti dlm qc nya

keybord kurang beres jga tetap dikirim",3,Lebih dari 1 tahun lalu,netral
https://www.tokopedia.com/electrocom/laptop-lenovo-thinkpad-t470-core-i5-gen7-ram-8gb-ssd-256gb-mulus-1733881974291989762/review,Flynn,"charger rusak, 2 keyboard lecet.",charger rusak  keyboard lecet,3,Lebih dari 1 tahun lalu,netral
https://www.tokopedia.com/electrocom/laptop-lenovo-thinkpad-t470-core-i5-gen7-ram-8gb-ssd-256gb-mulus-1733881974291989762/review,rama,Lebih dari 1 tahun lalu,lebih dari  tahun lalu,3,Lebih dari 1 tahun lalu,netral
https://www.tokopedia.com/onestopgaming/laptop-axioo-mybook-hype-5-ryzen-5-8gb-ram-256gb-ssd-14-ips-fhd-windows-11-pro-resmi-axioo-indonesia-adp-1731304871960085762/review,Nova,"window tidak ORI, di cek produk key nya ngga ada, bonus mousenya rusak klik kirinya ngga bisa, ada masalah sama alamat dan udah di putusin kalo saya yang ambil barangnya...",window tidak ori di cek produk key nya ngga ada bonus mousenya rusak klik kirinya ngga bisa ada masalah sama alamat dan udah di putusin kalo saya yang ambil barangnya,1,Lebih dari 1 tahun lalu,negatif
https://www.tokopedia.com/onestopgaming/laptop-axioo-mybook-hype-5-ryzen-5-8gb-ram-256gb-ssd-14-ips-fhd-windows-11-pro-resmi-axioo-indonesia-adp-1731304871960085762/review,P***h,"brg cpt rusak, utk penggunaan kantoran sebaiknya pilih merk lain",brg cpt rusak utk penggunaan kantoran sebaiknya pilih merk lain,1,Lebih dari 1 tahun lalu,negatif
